{
  "tenant_id": "11111111-1111-4111-8111-111111111111",
  "run_id": "22222222-2222-4222-8222-222222222222",
  "intent_id": "33333333-3333-4333-8333-333333333333",
  "strategy_id": null,
  "account_ref": "paper-account",
  "state": "approval_required",
  "payload": {
    "symbol": "NVDA",
    "side": "buy",
    "qty": 1
  },
  "risk_decision": {
    "ok": true
  },
  "idempotency_key": "intent-1",
  "orders": [],
  "fills": [],
  "created_at": "2026-06-24T13:30:00Z",
  "updated_at": "2026-06-24T13:30:05Z"
}
